,Title,Lenth,Words,Level,1 410,Título ,Longitud,Palabras,0,Titel ,Lenth,Words,0
,#1 Hero Section,,,,,#1 Sección Principal,,,,#1 Hauptabschnitt,,,
,"Content Creation: Engage, Inform, and Convert",45,6,H1,,,,,,,,,
,"Transform your digital presence with Qwantix's expert content creation strategies. Our creative specialists craft compelling, purpose-driven content that resonates with your target audience, drives engagement, and supports your business goals across all platforms.
Qwantix content creation expertise delivers:
Increased audience engagement
Enhanced brand storytelling
Improved content consistency
Higher search engine visibility
Greater conversion rates",453,48,,,,,,,,,,
Button,Elevate Your Content Strategy,29,4,,,,,,,,,,
,#2 Content: The Foundation of Digital Success,,,,,,,,,,,,
,Content: The Foundation of Digital Success,42,6,H2,,,,,,,,,
,Strategic content creation is essential for standing out in today's crowded digital landscape. Our approach helps you:,118,17,,,,,,,,,,
1,Develop a consistent and compelling brand voice across all channels,67,10,H3,,,,,,,,,
2,"Create valuable, engaging content that resonates with your target audience",74,10,H3,,,,,,,,,
3,Improve search engine visibility and organic traffic,52,7,H3,,,,,,,,,
4,Establish thought leadership in your industry,45,6,H3,,,,,,,,,
5,Support your sales funnel at every stage,40,7,H3,,,,,,,,,
6,Increase audience engagement and retention,42,5,H3,,,,,,,,,
7,Provide measurable ROI for your marketing efforts,49,7,H3,,,,,,,,,
8,Adapt content strategies to evolving market trends and audience needs,69,10,H3,,,,,,,,,
,"Qwantix combines creative expertise, industry knowledge, and data-driven insights to create content that captivates your audience and drives meaningful business results.",169,21,,,,,,,,,,
CTA,Elevate Your Content Strategy,29,4,,,,,,,,,,
Buttom,Get Your Free Content Audit,27,5,,,,,,,,,,
,#3 Driving Business Growth Through Strategic Content Creation,,,,,,,,,,,,
,Driving Business Growth Through Strategic Content Creation,58,7,H2,,,,,,,,,
,"At Qwantix, we leverage data-driven content creation strategies to deliver tangible results for businesses:",107,14,,,,,,,,,,
1,Content marketing generates 3x more leads than traditional marketing while costing 62% less,91,13,,,,,,,,,,
2,70% of consumers prefer getting to know a company through articles rather than ads,82,14,,,,,,,,,,
3,Businesses with blogs produce 67% more leads per month than those without,73,12,,,,,,,,,,
4,Long-form content generates 9x more leads than short-form content,65,9,,,,,,,,,,
5,Websites with blog content have 434% more indexed pages than those without,74,12,,,,,,,,,,
6,47% of buyers view 3-5 pieces of content before engaging with a sales rep,73,14,,,,,,,,,,
7,Companies that blog receive 97% more links to their website,59,10,,,,,,,,,,
,"Our strategic approach to content creation helps you capitalize on these trends, boosting brand awareness, driving engagement, and increasing conversions across all digital channels.",182,24,,,,,,,,,,
CTA,Ready to elevate your content strategy?,39,6,,,,,,,,,,
Buttom,Get Your Free Content Audit,27,5,,,,,,,,,,
,#4 Our Comprehensive Content Creation Approach,,,,,,,,,,,,
,Our Comprehensive Content Creation Approach,43,5,H2,,,,,,,,,
,"At Qwantix, we offer a full suite of content creation services designed to maximize your brand's impact across all digital channels:",132,21,,,,,,,,,,
1,Content Strategy Development,28,3,H3,,,,,,,,,
,Create a tailored content plan that aligns with your brand voice and business goals.,84,14,,,,,,,,,,
,"Impact: Consistent, purposeful content that supports your overall marketing objectives.",87,10,,,,,,,,,,
2,Multi-Format Content Production,31,3,H3,,,,,,,,,
,"Produce a variety of content types including blog posts, articles, whitepapers, ebooks, and more.",97,14,,,,,,,,,,
,Edge: Diverse content mix that caters to different audience preferences and stages of the buyer's journey.,106,16,,,,,,,,,,
3,Visual Content Creation,23,3,H3,,,,,,,,,
,"Design infographics, images, and other visual elements to enhance your content.",79,11,,,,,,,,,,
,Advantage: Increased engagement and improved information retention through compelling visuals.,94,10,,,,,,,,,,
4,Video Content Production,24,3,H3,,,,,,,,,
,Develop professional-quality videos for various platforms and purposes.,71,8,,,,,,,,,,
,Benefit: Higher engagement rates and improved brand storytelling capabilities.,78,9,,,,,,,,,,
5,Content Optimization for SEO,28,4,H3,,,,,,,,,
,Optimize all content for search engines to improve organic visibility.,70,10,,,,,,,,,,
,Value: Increased organic traffic and improved search engine rankings.,69,9,,,,,,,,,,
6,Content Localization,20,2,H3,,,,,,,,,
,"Adapt content for different markets, languages, and cultural contexts.",70,9,,,,,,,,,,
,Result: Expanded global reach and improved relevance for diverse audiences.,75,10,,,,,,,,,,
7,Content Performance Analysis,28,3,H3,,,,,,,,,
,Track key content metrics and provide actionable insights for improvement.,74,10,,,,,,,,,,
,Insight: Data-driven refinement of your content strategy for optimal results.,77,10,,,,,,,,,,
,"Qwantix leverages creative expertise, industry knowledge, and data-driven insights to create content that captivates your audience, supports your business goals, and drives measurable results across all platforms.",213,27,,,,,,,,,,
CTA,Ready to elevate your content strategy?,39,6,,,,,,,,,,
Buttom,Get Your Free Content Audit,27,5,,,,,,,,,,
,#5 Why Choose Qwantix for Content Creation?,,,,,,,,,,,,
,Why Choose Qwantix for Content Creation?,40,6,H2,,,,,,,,,
,"At Qwantix, we offer unique advantages in content creation:",59,9,,,,,,,,,,
1,Comprehensive Content Expertise,31,3,H3,,,,,,,,,
,"Our team excels in creating various content types, from blog posts to videos.",77,13,,,,,,,,,,
2,Data-Driven Content Strategy,28,3,H3,,,,,,,,,
,"We use analytics to inform our content decisions, ensuring maximum engagement and ROI.",86,13,,,,,,,,,,
3,SEO-Optimized Content,21,2,H3,,,,,,,,,
,"Our content is crafted to perform well in search engines, increasing organic visibility.",88,13,,,,,,,,,,
4,Brand Voice Consistency,23,3,H3,,,,,,,,,
,We maintain your unique brand voice across all content types and platforms.,75,12,,,,,,,,,,
5,Multi-Format Content Production,31,3,H3,,,,,,,,,
,"Our in-house team produces high-quality written, visual, and interactive content.",81,10,,,,,,,,,,
6,Content Localization Capabilities,33,3,H3,,,,,,,,,
,"We adapt content for different markets, ensuring global relevance and impact.",77,11,,,,,,,,,,
7,Agile Content Creation Process,30,4,H3,,,,,,,,,
,Our streamlined process allows for quick turnarounds without compromising quality.,82,10,,,,,,,,,,
8,Continuous Performance Analysis,31,3,H3,,,,,,,,,
,"We constantly monitor content performance, refining our approach for optimal results.",85,11,,,,,,,,,,
CTA,Maximize your content's potential with Qwantix experts,54,7,,,,,,,,,,
Buttom,Get Your Free Content Strategy Consultation,43,6,,,,,,,,,,
,#6 Our Content Creation Process,,,,,,,,,,,,
,Our Content Creation Process,28,4,H2,,,,,,,,,
,"At Qwantix, we follow a systematic approach to content creation, tailored to maximize engagement and support your business goals:",129,19,,,,,,,,,,
1,Content Audit and Goal Alignment,32,5,H3,,,,,,,,,
,We analyze your existing content and align creation goals with your overall marketing strategy.,95,14,,,,,,,,,,
,Impact: Content that supports your broader business objectives.,63,8,,,,,,,,,,
2,Audience Research and Persona Development,41,5,H3,,,,,,,,,
,We conduct in-depth audience research to inform content creation.,65,9,,,,,,,,,,
,Precision: Tailored content that resonates with your specific target groups.,76,10,,,,,,,,,,
3,Content Strategy Formulation,28,3,H3,,,,,,,,,
,We develop a comprehensive content strategy across all relevant channels.,73,10,,,,,,,,,,
,Advantage: Cohesive content approach that leverages each platform's strengths.,78,9,,,,,,,,,,
4,Content Calendar Planning,25,3,H3,,,,,,,,,
,We create a detailed content calendar to ensure consistent and timely publishing.,81,12,,,,,,,,,,
,Benefit: Strategic content distribution and improved campaign cohesion.,71,8,,,,,,,,,,
5,Multi-Format Content Production,31,3,H3,,,,,,,,,
,"We produce a variety of content types including blog posts, articles, videos, and infographics.",95,14,,,,,,,,,,
,Value: Diverse and engaging content mix that caters to different user preferences.,82,12,,,,,,,,,,
6,SEO Optimization,16,2,H3,,,,,,,,,
,We optimize all content for search engines to improve organic visibility.,73,11,,,,,,,,,,
,Result: Increased organic traffic and improved search engine rankings.,70,9,,,,,,,,,,
7,Content Performance Analysis,28,3,H3,,,,,,,,,
,We continuously monitor content performance and gather insights for improvement.,80,10,,,,,,,,,,
,Insight: Data-driven refinement of your content strategy for optimal results.,77,10,,,,,,,,,,
CTA,Ready to elevate your content strategy?,39,6,,,,,,,,,,
Buttom,Get Your Custom Content Creation Plan,37,6,,,,,,,,,,
,#7 Content Creation FAQ,,,,,,,,,,,,
,Content Creation FAQ,20,3,H2,,,,,,,,,
1,What types of content are most effective for digital marketing?,63,10,H3,,,,,,,,,
,"The most effective content types vary depending on your audience and goals, but generally include blog posts, videos, infographics, case studies, whitepapers, and social media posts. The key is to provide value and engage your target audience across multiple formats.",267,40,,,,,,,,,,
2,How often should we create new content?,39,7,H3,,,,,,,,,
,"Content creation frequency depends on your resources and goals. Generally, aim for consistency rather than quantity. For most businesses, publishing 1-2 high-quality blog posts per week and daily social media updates is a good starting point. Adjust based on your audience's engagement and your capacity.",304,45,,,,,,,,,,
3,How do we measure the success of our content?,45,9,H3,,,,,,,,,
,"Key metrics include engagement (likes, shares, comments), traffic to your website, time spent on page, conversion rates, and SEO rankings. Also consider qualitative feedback and how well the content aligns with your overall marketing goals.",240,35,,,,,,,,,,
4,How can we ensure our content is SEO-friendly?,46,8,H3,,,,,,,,,
,"Focus on creating high-quality, relevant content that addresses your audience's needs. Use keyword research to inform your topics, optimize your titles and meta descriptions, include relevant internal and external links, and ensure your content is mobile-friendly and loads quickly.",282,39,,,,,,,,,,
5,What's the ideal length for different types of content?,55,9,H3,,,,,,,,,
,Content length varies by format and platform:,45,7,,,,,,,,,,
,"Blog posts: 1,500-2,500 words for in-depth pieces",49,7,,,,,,,,,,
,"Social media posts: Varies by platform (e.g., 280 characters for Twitter)",73,11,,,,,,,,,,
,"Videos: 2-3 minutes for most platforms, longer for YouTube",58,9,,,,,,,,,,
,"Infographics: No more than 8,000 pixels long",44,7,,,,,,,,,,
6,How can we repurpose content effectively?,41,6,H3,,,,,,,,,
,"Adapt your content to fit different formats and platforms. For example, turn a long-form blog post into a series of social media posts, create an infographic from a data-heavy article, or transform a webinar into a series of short video clips.",243,41,,,,,,,,,,
7,How do we maintain brand consistency across different types of content?,71,11,H3,,,,,,,,,
,"Develop clear brand guidelines that outline your voice, tone, visual style, and key messages. Ensure all content creators have access to these guidelines and regularly review content for consistency.",199,29,,,,,,,,,,
CTA,Ready to elevate your content strategy?,39,6,,,,,,,,,,
Buttom,Get Your Customized Content Creation Plan,41,6,,,,,,,,,,
,#8 Ready to Elevate Your Content Strategy?,,,,,,,,,,,,
,Ready to Elevate Your Content Strategy?,39,6,H2,,,,,,,,,
,Take the first step towards content creation excellence with Qwantix. Choose the option that best fits your needs:,114,18,,,,,,,,,,
1,Content Audit and Strategy Assessment,37,5,H3,,,,,,,,,
,Get a comprehensive review of your current content and strategy across all channels.,84,13,,,,,,,,,,
CTA,Uncover your content improvement potential,42,5,,,,,,,,,,
Buttom,Request Free Content Audit,26,4,,,,,,,,,,
2,Content Strategy Workshop,25,3,H3,,,,,,,,,
,Schedule a hands-on session with our content specialists to develop ideas and strategies for your content marketing.,116,17,,,,,,,,,,
CTA,Explore creative content possibilities,38,4,,,,,,,,,,
Buttom,Book Content Strategy Workshop,30,4,,,,,,,,,,
3,Custom Content Plan Development,31,4,H3,,,,,,,,,
,Let us create a tailored content plan aligned with your brand voice and marketing goals.,88,15,,,,,,,,,,
CTA,Receive a strategic content roadmap,35,5,,,,,,,,,,
Buttom,[Get Custom Content Plan],25,4,,,,,,,,,,
4,Multi-Format Content Package,28,3,H3,,,,,,,,,
,Get a set of professionally created content pieces optimized for your primary channels.,87,13,,,,,,,,,,
CTA,Kickstart your content marketing,32,4,,,,,,,,,,
Buttom,Request Content Package,23,3,,,,,,,,,,
,"Not sure which option is right for you? Don't worry – our content creation experts are here to help. Contact us, and we'll guide you through the process.",153,28,,,,,,,,,,
CTA,Let's elevate your content strategy,35,5,,,,,,,,,,
Buttom,Contact Qwantix Content Team,28,4,,,,,,,,,,